13350,,08/07/2024,Fortune Moxon Limited,Moxon Street - 41 Flats & Office,Communal,New,104,1,Domestic,Residential,Air Source Heat Pumps,,,,,,Electric,,,,,Yes,,No,,,Under Construction,Under Construction,"Site B3, Riverside Wharf, Swansea Waterfront",West Glamorgan,Wales,Wales,SA1 8AW,266345,192983,Swansea,2023/0357/OUT,,,,,14/02/2023,,,,,,,09/11/2023,,,,09/11/2025,01/04/2024,,
13351,,30/10/2023,SAMA Investments Limited,"Garrison Circus - 686 Student Flats, 515 Flats & Commercial",Communal,New,10,1,Domestic,Residential,Air Source Heat Pumps,,,,,,Electric,,,,,Yes,,No,,,Planning Permission Granted,Awaiting Construction,26-28 Rochester Place,London,London,England,NW1 9DF,529243,184433,Camden,2023/0270/P,,,,,16/02/2023,,,,,,,11/10/2023,,,,11/10/2026,,,
13352,,26/09/2023,Places for People Developments Limited,Icknield Square - 243 Flats & Commercial Space,Communal,New,346,3,Mixed,"Residential, Unspecified Commercial",Air Source Heat Pumps,,,,,,Electric ,,,,,Yes,,No,,,Planning Permission Granted,Awaiting Construction,"Lea Bridge Road, Leyton",London,London,England,E10 7PG,536132,187257,Waltham Forest,212685,,,,,26/08/2021,,,,,,,10/02/2023,,,,10/02/2026,,,
13353,,16/01/2024,Lipman Properties Limited,East Ferry Road - 26 Flats & Commercial,Communal,New,263,3,Mixed,"Residential, Retail",Air Source Heat Pumps,,,,,,Electric,,,,,Yes,,No,,,Revised,Revised,"The Former Bell Green Gas Works, Bell Green",London,London,England,SE26 2QT,536403,172064,Lewisham,DC/23/129814,,,,,10/02/2023,04/08/2023,,,,,,,,,,,,,
13363,,06/03/2023,AG Bloom Lml BV / Melburg,"360 Building, Marlborough Street - Student Accommodation",Communal,New,26,2,Domestic,Residential,Air Source Heat Pumps,,,,,,Electric,,,,,Yes,,No,,,Planning Application Submitted,Application Submitted,N/O Quilter Close,Gwent,Wales,Wales,NP19 9RD,334685,187805,Newport,23/0085,,,,,14/02/2023,,,,,,,,,,,,,,
13364,,15/05/2023,Tri7 Banbury LLP,Calthorpe Street - 221 Flats & 9 Houses,District,Expansion,2,1,Domestic,Residential,Air Source Heat Pumps,,,,,,Electric,,,,,Yes,,No,,,Planning Permission Granted,Awaiting Construction,"129 Queensway, Paddington",London,London,England,W2 4SJ,525840,180930,Westminster,23/00982/FULL,,,,,15/02/2023,,,,,,,09/05/2023,,,,,,,
13365,,06/10/2023,Richmond Housing Partnership,Sheldon House - 27 Apartments,District,Expansion,130,6,Mixed,"Residential, Office, Retail, Arena, Gym, Hotel",EfW Incineration,,,,,,Gas,Heat from Energy from Waste Plants,,,,Yes,,,,,Planning Permission Granted,Awaiting Construction,"Ashton Gate Stadium, Land On The North-East Side Of Winterstoke Road, Bristol",South Gloucestershire,South West,England,BS3 2EJ,356933,171393,"Bristol, City of",21/03165/F,,,,,08/06/2021,,,,,,,22/08/2023,,,,22/08/2026,,,
13366,,09/03/2023,AvantGlamp Resorts Limited,"The Rough, National Exhibition Centre - Eco Resort",Communal,New,78,2,Domestic,Residential,Air Source Heat Pumps,Gas Boiler,,,,,Electric,,,,,Yes,,No,,,Planning Permission Granted,Awaiting Construction,"Durning Hall Community Centre, Earlham Grove, Forest Gate",London,London,England,E7 9AB,540401,185250,Newham,20/02849/FUL,,,,,21/12/2020,,,,,,,12/12/2022,,,,,,,
13367,,09/03/2023,Phoenix UK Prop Co Limited,"Ilderton Road, Bermondsey - 615 Bedroom Student Accommodation",Communal,New,233,2,Mixed,"Residential, Unspecified Commercial",Air Source Heat Pumps,,,,,,Electric,,50.00,,,Yes,,No,,,Planning Application Submitted,Application Submitted,"79-161 Ilderton Road, Rotherhithe",London,London,England,SE16 3JZ,535156,178319,Southwark,23/AP/0387,,,,,23/02/2023,,,,,,,,,,,,,,
13376,,02/01/2024,"The Corsham School Academy Group
","The Corsham School, The Tynings - Biomass Boilers",Communal,New,19,1,Domestic,Residential,Air Source Heat Pumps,,,,,,Electric,,,,,Yes,,No,,,Planning Application Withdrawn,Application Withdrawn,"33 Wilcox Road, South Lambeth",London,London,England,SW8 2XA,530179,177311,Lambeth,23/00507/FUL,,,,,13/02/2023,01/12/2023,,,,,,,,,,,,,
13377,,09/03/2023,The PG Group,Redcross Mews - 34 Flats,Communal,New,8,1,Mixed,"Residential, Retail, Hotel",Air Source Heat Pumps,,,,,,Electric,,,,,Yes,,No,,,Planning Application Submitted,Application Submitted,"New College, 9-12 Parade Finchley Road, Hampstead",London,London,England,NW3 5EX,526491,184534,Camden,2022/5568/P,,,,,23/02/2023,,,,,,,,,,,,,,
13386,,09/05/2023,Anchor Hanover,Waverley Road - Retirement Living Development,Campus,New,1,2,Non Domestic,Agricultural,Ground Source Heat Pumps,,,,4.00,,Electric,Shallow Geothermal,,,,Yes,,No,,,Planning Permission Granted,Awaiting Construction,Green Hurst Farm Wood Lane Marchamley Wood ,Shropshire,West Midlands,England,SY4 5LH,359540,331202,Shropshire,23/00691/FUL,,,,,01/03/2023,,,,,,,04/04/2023,,,,04/04/2026,,,
13425,,12/04/2023,Mid Kent College,"Mid Kent College Medway Campus, Medway Road - Ground Source Heat Pumps",Communal,New,40,1,Domestic,Residential,Air Source Heat Pumps,,,,,,Electric,,,,,Yes,,No,,,Planning Permission Granted,Awaiting Construction,"45 Thicket Crescent, Sutton",London,London,England,SM1 4QB,"	526430","	164727",Sutton,DM2023/00254,,,,,28/02/2023,,,,,,,05/04/2023,,,,05/04/2026,,,
13426,,20/03/2024,Private Developer,"Former Royal Alexandra Infirmary, Calside - 81 Flats",Communal,New,76,2,Domestic,Care Village,Air Source Heat Pumps,,,,,,Electric,,,,,Yes,,No,,,Under Construction,Under Construction,"14 Newnton Close, Finsbury Park",London,London,England,N4 2RQ,532786,187833,Hackney,2021/2732,,,,,03/09/2021,,,,,,,27/05/2022,,,,21/02/2026,01/06/2023,,
13427,,14/07/2023,Pembroke College,"Pembroke College, Foundress Court - Air Source Heat Pumps",District,New,340,4,Mixed,"Residential, Unspecified Commercial",Gas Fired CHP,,,,,,Gas,,70.00,,,Yes,,Yes,,,Under Construction,Under Construction,"Se/O 98 Ocean Drive, Edinburgh",Lothian,Scotland,Scotland,EH6 6JJ,326487,676970,City of Edinburgh,19/02778/FUL,,,,,10/06/2019,,,,,,,26/07/2019,,,,03/11/2023,01/04/2023,,
13452,,26/09/2023,Anchor Hanover,"Fronting Rose Way, Melton Road - 77 Care Apartments",Campus,Renovation,1,,Non Domestic,Hospital,Ammonia-liquid Heat Pump,,,,,,Electric,,,,,Yes,,No,,,Planning Permission Granted,Awaiting Construction,"University Hospital Nhs Trust, Queens Medical Centre, Derby Road, Nottingham",Nottinghamshire,East Midlands,England,NG7 2UH,454800,"	338800 ",Nottingham,23/00267/PFUL3,,,,,21/02/2023,,,,,,,19/09/2023,,,,19/09/2026,,,
13453,,08/04/2024,Serruys Property Company,Deal Ground & May Gurney - Mixed Development,Campus,New,1,5,Non Domestic,Office,Ground Source Heat Pumps,,,,,,Electric,Shallow Geothermal,,,,Yes,,No,,,Planning Permission Granted,Awaiting Construction,"New Science Park, W/O The Junction With The Boulevard Oxford Airport, Langford Lane, Kidlington",Oxfordshire,South East,England,OX5 1NZ,447717,"	214940",Cherwell,23/00517/F,,,,,03/03/2023,,,,,,,22/03/2024,,,,22/03/2027,,,
13454,,16/03/2023,Aviv Comp Limited,"383 Holloway Road, Marlborough House - 60 Flats",Communal,New,20,1,Domestic,Residential,Air Source Heat Pumps,,,,,,Electric,,,,,Yes,,No,,,Planning Application Submitted,Application Submitted,"Drum Housing Association, Drum Court, The Spain, Petersfield",Hampshire,South East,England,GU32 3NG,"	474376","	123257",East Hampshire,SDNP/23/00302/FUL,,,,,24/01/2023,,,,,,,,,,,,,,
13455,,16/03/2023,HSW Holdings,Brunswick Street - 9 Flats,Communal,New,455,1,Domestic,Residential,Air Source Heat Pumps,,,,,,Electric,,,,,Yes,,No,,,Planning Application Submitted,Application Submitted,"Croydon Park Hotel, 7 Altyre Road, Croydon",London,London,England,CR9 5AA,532967,165511,Croydon,23/00872/FUL,,,,,06/03/2023,,,,,,,,,,,,,,
13456,,13/06/2024,Erith Hills Llp,Erith Quarry - Parcel 3B - 31 Apartments,Communal,New,475,1,Domestic,Residential,Air Source Heat Pumps,,,,,,Electric,,,,,Yes,,No,,,Planning Permission Granted,Awaiting Construction,"Holland House, 20 Oxford Road, Bournemouth",Dorset,South West,England,BH8 8EF,409542,91707,"Bournemouth, Christchurch and Poole",7-2023-11310-CP,,,,,06/03/2023,,,,,,,24/05/2024,,,,,,,
13477,,08/03/2024,NG Devco Limited,81 Newgate Street - Office/Retail Extension,Campus,New,1,,Non Domestic,Holiday Village,Air Source Heat Pumps,,,,,,Electric,,,,,Yes,,No,,,Planning Permission Granted,Awaiting Construction,"Farthingstone Hotel & Golf Course, Everdon Road, Farthingstone, Towcester",Northamptonshire,East Midlands,England,NN12 8HA,"	460250","	255114",West Northamptonshire,WND/2023/0155,,,,,02/03/2023,,,,,,,23/06/2023,,,,23/06/2026,,,
13478,,08/07/2024,South Warwickshire NHS Foundation Trust,"Warwick Hospital, Lakin Road - Air Source Heat Pump",District,New,196,2,Mixed,Student Accommodation,Air Source Heat Pumps,,,,,,Electric,,,,,Yes,,No,,,Planning Permission Granted,Awaiting Construction,"St James Health Centre, 47 St James Street, Walthamstow",London,London,England,E17 7PJ,536406,188705,Waltham Forest,230208,,,,,24/02/2023,,,,,,,07/06/2024,,,,,,,
13481,,27/09/2023,The George Müller Charitable Trust,Muller House - 6 Flats & 5 Houses,Campus,New,1,,Non Domestic,University ,Ground Source Heat Pumps,,,,0.65,,Electric,Shallow Geothermal,,,,Yes,,No,,,Revised,Revised,University College For The Creative Arts 21 Ashley Road,Surrey,South East,England,KT18 5BE,520972,160400,Epsom and Ewell,23/00291/PDPV,,,,,07/03/2023,,,,,,,,,,,,,,
13490,,06/06/2023,Respect Developments,Glenrothes Crematorium,District,Expansion,,,,Unspecified,EfW Incineration,,,,,,Gas,Heat from Energy from Waste Plants,,,,Yes,,No,4500.00,,Planning Application Withdrawn,Application Withdrawn,London Borough Of Enfield West Of Bounds Green Brook Along Bowes Road And Palmers Road To The Arnos Grove Energy Centre,London,London,England,N11 1AN,529337,192428,Enfield,23/00330/FUL,,,,,08/03/2023,01/06/2023,,,,,,,,,,,,,
13500,,07/02/2024,Plymouth City Council,"Theatre Royal, Royal Parade - District Heating",Communal,New,100,2,Domestic,Residential,Air Source Heat Pumps,,,,,,Electric,,,,,Yes,,No,,,Revised,Revised,"Garratt Lane, & Atheldene Road Development Site, Wandsworth",London,London,England,SW18 4UE,525955,173707,Wandsworth,2023/0601,,,,,15/03/2023,16/01/2024,,,,,,,,,,,,,
13513,,24/03/2023,Asset Plus,"Evergreen Court, Ruislip Road East - Air Source Heat Pumps",District,Expansion,3,1,Mixed,"Student Accommodation, Café, Unspecified Commercial",Gas Fired CHP,,,,,,Gas,,,,,Yes,,Yes,,,Planning Application Submitted,Application Submitted,"Plot N16, Zone 3 Stratford City, 50 Celebration Avenue, Olympic Park",London,London,England,E20 1DB,538215,185089,Newham,23/00101/FUL,,,,,27/02/2023,,,,,,,,,,,,,,
13514,,09/11/2023,Thackeray Estates,3-7 Park Street - Commercial & 23 Flats,District,Expansion,,,,Unspecified,EfW Incineration,,,,,,Gas,Heat from Energy from Waste Plants,,,,Yes,,No,7000.00,,Planning Application Withdrawn,Application Withdrawn,"W/O Silver Street Station, A406 Via Wilbury Way, Enfield",London,London,England,N18 1BX,532964,192135,Enfield,23/00327/FUL,,,,,02/02/2023,08/11/2023,,,,,,,,,,,,,
13521,,17/05/2024,First Endeavour LLP,Former Hillside Hospital - 72 Flats,Communal,New,70,1,Domestic,Residential,Air Source Heat Pumps,,,,,,Electric,,45.00,,,Yes,,No,,,Planning Permission Granted,Awaiting Construction,"Walnut Tree Depot Site, Stonewood Road, Erith",London,London,England,DA8 1RA,551322,178072,Bexley,23/00254/FULM,,,,,14/03/2023,,,,,,,19/04/2024,,,,19/04/2027,,,
13522,,02/04/2024,Palm Lane Estates Limited,Algha Works - Incubator Workspace & Tethered Living Accommodation,Communal,New,178,1,Mixed,"Residential, Café, Industrial",Air Source Heat Pumps,,,,0.99,,Electric,,25.00,,,Yes,,No,,,Planning Permission Granted,Awaiting Construction,"3 School Road, Willesden",London,London,England,NW10 6TD,520914,182196,Ealing,23/0026/FUMOPDC,,,,,28/02/2023,,,,,,,28/03/2024,,,,27/03/2027,,,
13523,,15/05/2023,Reef Estates Limited/UrbanR,The Fourth Mile,Communal,New,43,1,Domestic,Residential,Air Source Heat Pumps,,,,,,Electric,,,,,Yes,,No,,,Planning Application Submitted,Application Submitted,"254-268 Camberwell Road, Camberwell",London,London,England,SE5 0DP,532440,177035,Southwark,20/AP/3482,,,,,27/11/2020,,,,,,,,,,,,,,
13524,,29/03/2023,JRL Midgard Limited,"3 -12 High Street, Woking - Shared Living & Commercial",Communal,New,83,1,Domestic,Residential,Air Source Heat Pumps,,,,,,Electric,,25.00,,,Yes,,No,,,Planning Application Submitted,Application Submitted,"5-7 Park Royal Road, The Lower Park Trading Estate, Acton",London,London,England,W3 6XA,520406,182043,Ealing,23/0014/FUMOPDC,,,,,03/02/2023,,,,,,,,,,,,,,
13556,,30/05/2023,GM Developments Limited,Kingston Riverside - 34 Apartments & Commercial Units,District,New,10,10,Mixed,"Residential, Primary School, Public House, Town Hall, Religious Building",Biomass (dedicated),,,,0.20,,Woodchip,,,,,Yes,,No,,,Planning Application Withdrawn,Application Withdrawn,"E/o Churchyard St Peters Church, Church Road, Hever, Edenbridge",Kent,South East,England,TN8 7NG,547830,145188,Sevenoaks,23/00739/FUL,,,,,14/03/2023,22/05/2023,,,,,,,,,,,,,
13558,,13/06/2023,ETGAS Burnley Limited,"Hapton Valley Transfer Station, Accrington Road - Combined Heat And Power",Communal,New,14,1,Domestic,Residential,Air Source Heat Pumps,,,,,,Electric,,,,,Yes,,No,,,Planning Application Withdrawn,Application Withdrawn,"George Alfred Dyer House, 51 Neptune Street, Rotherhithe",London,London,England,SE16 7JP,535233,179524,Southwark,23/AP/0336,,,,,23/03/2023,06/06/2023,,,,,,,,,,,,,
13577,,23/05/2023,Dulwich Picture Gallery,Dulwich Picture Gallery - Childrens Picture Gallery & Extension,Campus,New,1,5,Non Domestic,Industrial,Gas Fired CHP,,,,1.20,,Gas,,,,,Yes,,Yes,,,Planning Permission Granted,Awaiting Construction,"Ppg Industries Uk Limited, Main Site, Needham Road, Stowmarket",Suffolk,Eastern,England,IP14 2AD,606087,257359,Mid Suffolk,DC/23/01239,,,,,24/03/2023,,,,,,,19/05/2023,,,,19/05/2026,,,
13578,,03/04/2023,SSE Energy Solutions,"Skelton Grange Road, Aire Valley - Energy Centre",Communal,New,47,4,Domestic,Residential,Air Source Heat Pumps,,,,,,Electric,,40.00,,,Yes,,No,,,Planning Application Submitted,Application Submitted,"238 Union Street, Plymouth",Devon,South West,England,PL1 3HW,246636,54438,Plymouth,21/01962/FUL,,,,,10/11/2021,,,,,,,,,,,,,,
13579,,03/04/2023,De Montfort University,De Montfort University - Low Carbon Heat Network,Communal,New,760,5,Mixed,"Residential, Unspecified Commercial",Air Source Heat Pumps,Gas Boiler,,,,,Electric,,50.00,,,Yes,,No,,,Under Construction,Under Construction,"Euro House, Fulton Road, Wembley",London,London,England,HA9 0TF,519584,185979,Brent,21/2989,,,,,02/08/2021,,,,,,,26/01/2021,,,,,,,
13613,,29/06/2023,Vattenfall Heat Limited,"Bedminster Green, Phases 1, 2, & 3 - District Heat Network",Campus,Renovation,1,,Non Domestic,Hospital,Air Source Heat Pumps,,,,0.60,,Electric,,,,,Yes,,No,,,Planning Permission Granted,Awaiting Construction,"Northampton General Hospital, Billing Road",Northamptonshire,East Midlands,England,NN1 5BD,476319,260349,West Northamptonshire,WNN/2023/0319,,,,,29/03/2023,,,,,,,11/05/2023,,,,11/05/2026,,,
13648,,24/11/2023,Warrington Borough Council,"Warrington Borough Council, Town Hall - Ground Source Heat Pump Array",Communal,New,10,1,Domestic,Residential,Air Source Heat Pumps,,,,,,Electric,,45.00,,,Yes,,No,,,Planning Application Withdrawn,Application Withdrawn,"21-23 Station Terrace, Willesden",London,London,England,NW10 5RP,523619,183123,Brent,23/0930,,,,,30/03/2023,07/11/2023,,,,,,,,,,,,,
13649,,15/05/2023,Calthorpe Estates,Harrisons Road - 6 Houses & 28 Flats,Communal,New,46,1,Domestic,Residential,Air Source Heat Pumps,,,,,,Electric,,,,,Yes,,No,,,Planning Application Submitted,Application Submitted,"Syward Place, 40 - 48 Pyrcroft Road, Chertsey",Surrey,South East,England,KT16 9JT,"	503772","	166558",Runnymede,RU.23/0356,,,,,06/03/2023,,,,,,,,,,,,,,
13650,,22/08/2023,NHS Lanarkshire Kirklands Hospital,Monklands Hospital Replacement Project,Campus,New,1,3,Non Domestic,Industrial,EfW Incineration,,,,,,Gas,Heat from Energy from Waste Plants,,,,Yes,,No,,,Planning Permission Granted,Awaiting Construction,"Ty To Maen Farm, Newton Road, Wentloog, Cardiff",South Glamorgan,Wales,Wales,CF3 2EJ,323883,178383,Cardiff,21/01906/MJR,,,,,05/08/2021,,,,,,,25/07/2023,,,,25/07/2028,,,
13663,,21/06/2023,John Lewis Partnership,Waitrose West Ealing - Mixed Development,Communal,New,6,1,Domestic,Residential,Air Source Heat Pumps,,,,,,Electric,,,,,Yes,,No,,,Planning Application Withdrawn,Application Withdrawn,"179 Kingston Road, Oxford",Oxfordshire,South East,England,OX2 6EG,"	450594",207325,Oxford,23/00593/FUL,,,,,27/03/2023,19/06/2023,,,,,,,,,,,,,
13674,,18/04/2023,Wheatley Housing Group Limited / Glasgow Housing Association,80 Ashwood Drive - 9 Flats & Office,Communal,New,42,1,Domestic,Residential,Air Source Heat Pumps,,,,,,Electric,,,,,Yes,,No,,,Planning Application Submitted,Application Submitted,"Multi Storey Car Park, Church Road, Ashford",Surrey,South East,England,TW15 2TY,506836,171604,Spelthorne,23/00388/FUL,,,,,05/04/2023,,,,,,,,,,,,,,
13675,,31/05/2024,South Norfolk District Council,Kestrel House - Installation of Ground Source Heat Pumps and Solar Pv panels,Communal,New,22,1,Domestic,Residential,Air Source Heat Pumps,,,,,,Electric,,,,,Yes,,No,,,Under Construction,Under Construction,"38-44 Ballards Lane, Finchley Church End",London,London,England,N3 2BJ,525315,190823,Barnet,21/4977/FUL,,,,,14/09/2021,,,,,,,31/03/2023,,,,31/03/2026,23/10/2023,,
13724,,13/07/2023,Prudential Assurance Company Limited,2 Waterhouse Square - Extension,District,Renovation,1456, ,Domestic,Residential,Air Source Heat Pumps,Hydrogen Boiler,, , , ,Electric, , , , ,Yes, ,Yes, , ,Planning Permission Granted,Awaiting Construction,South West Of 1 To 71 Chervil Rise,West Midlands,West Midlands,England,WV10 0QA,392982,299413,Wolverhampton,23/00368/FUL, , , , ,14/04/2023,,,,,,,24/05/2023,,,,24/05/2026,,,
13741,,25/04/2023,Leos Weybridge Development Limited,Brooklands Road - 168 Flats & 18 Houses,Communal,New,101,2,Domestic,Residential,Air Source Heat Pumps,,,,,,Electric,,,,,Yes,,No,,,Planning Application Submitted,Application Submitted,"341a Seven Sisters Road, Tottenham",London,London,England,N15 6RD,532787,188068,Haringey,HGY/2023/0728,,,,,14/03/2023,,,,,,,,,,,,,,
13742,,25/04/2023,Dawliffe Hall Educational Foundation,29 Pembridge Square - 14 Flats,Communal,New,124,1,Domestic,Residential,Air Source Heat Pumps,,,,,,Electric,,,,,Yes,,No,,,Planning Application Submitted,Application Submitted,"8 -10 Greenock Road, Acton",London,London,England,W3 8DU,520021,179157,Ealing,231285FUL,,,,,23/03/2023,,,,,,,,,,,,,,
13751,,26/04/2023,Skillcrown Homes Limited,52-62 West Hill - 90 Bedroom Hotel & 40 Flats,District,New,531,2,Domestic,"Residential,  Student Accommodation",Air Source Heat Pumps,,,,,,Electric,,,,,Yes,,No,,,Planning Application Submitted,Application Submitted,"Holiday Inn Express, Victoria Road, Acton",London,London,England,W3 6UL,520875,181844,Ealing,23/0051/FUMOPDC,,,,,30/03/2023,,,,,,,,,,,,,,
13752,,26/04/2023,John Lewis Partnership,"Bromley South, Masons Hill - 353 Flats/Waitrose",Communal,New,123,1,Domestic,Student Accommodation,Air Source Heat Pumps,,,,,,Electric,,,,,Yes,,No,,,Planning Application Submitted,Application Submitted,"5-9 Creekside, Deptford",London,London,England,SE8 4SA,537469,177150,Lewisham,DC/23/131085,,,,,05/04/2023,,,,,,,,,,,,,,
13753,,26/04/2023,Leeds City Council,Old Technology Campus - Leeds PIPES District Heating Network,Communal,New,93,3,Mixed,"Residential, Unspecified Commercial",Air Source Heat Pumps,,,,,,Electric,,,,,Yes,,No,,,Planning Application Submitted,Application Submitted,"Omega Works, Hermitage Road, Finsbury Park",London,London,England,N4 1LZ,532349,188155,Haringey,HGY/2023/0570,,,,,27/03/2023,,,,,,,,,,,,,,
13754,,10/01/2024,Metropolitan Properties (Investments) Limited,St Marks Hill - 17 Apartments & Commercial Space,Communal,New,67,1,Domestic,Residential,Air Source Heat Pumps,,,,,,Electric,,55.00,,,Yes,,No,,,Planning Permission Refused,Application Refused,"Status Park, Nobel Drive, Harlington, Hayes",London,London,England,UB3 5EY,509107,177025,Hillingdon,74423/APP/2023/755,,,,,11/04/2023,,21/12/2023,,,,,,,,,,,,
13755,,29/04/2024,University for the Creative Arts,"University for the Creative Arts
, Ashley Road - GSHP, Battery & Solar Panels",Communal,New,28,1,Domestic,Care Village,Air Source Heat Pumps,,,,,,Electric,,,,,Yes,,No,,,Planning Permission Granted,Awaiting Construction,"Knoll House, Ingram Crescent West, Hove",East Sussex,South East,England,BN3 5NX,527217,105536,Brighton and Hove,BH2023/00912,,,,,17/04/2023,,,,,,,18/10/2023,,,,18/10/2026,,,
13756,,31/05/2024,Greystar Europe Holdings Limited,The Bermondsey Project,Campus,New,1,2,Non Domestic,Hospital,Ground Source Heat Pumps,,,Gas CHP,,,Electric,Shallow Geothermal,45.00,,,Yes,Yes,Yes,,,Under Construction,Under Construction,"Birmingham Childrens Hospital, Steelhouse Lane, Birmingham",West Midlands,West Midlands,England,B4 6NH,407264,287478,Birmingham,2023/01979/PA,,,,,24/03/2023,,,,,,,24/08/2023,,,,24/08/2026,01/10/2023,,
13769,,12/12/2023,Evergreen Blue Limited,"2 Cannon Street, Wapping Wharf - 60 Flats",Campus,Renovation,1,3,Non Domestic,University,Air Source Heat Pumps,Water Source Heat Pumps,,Gas Boiler,,,Electric,,,,,Yes,,No,,,Revised,Revised,"Arts University Bournemouth, Fern Barrow, Poole",Dorset,South West,England,BH12 5BF,407413,93515,"Bournemouth, Christchurch and Poole",APP/23/00454/F,,,,,11/04/2023,,,,,,,,,,,14/07/2026,,,
13819,,05/05/2023,Torus Property Solutions,Baltic 2 -  Mixed Use Development,Communal,New,104,1,Domestic,Residential,Air Source Heat Pumps,,,,,,Electric,,,,,Yes,,No,,,Planning Application Submitted,Application Submitted,Jnct Of Vaughan Way & St Margarets Way,Leicestershire,East Midlands,England,LE1 4QF,458510,304969,Leicester,20230634,,,,,19/04/2023,,,,,,,,,,,,,,
13858,,12/05/2023,Link Group ,Caledonian Road - 21 Flats,District,Expansion,1,1,Non Domestic,Leisure Centre,Biomass (dedicated),,,,1.40,,Woodchip,,,,,Yes,,No,,,Pre-Planning,Pre-Planning,"Visions Leisure Centre, Auchinleck Road, Cumnock",Strathclyde,Scotland,Scotland,KA18 1AN,256293,620300,East Ayrshire,,,,,,,,,,,,,,,,,,,,
13859,,12/05/2023,Old Manor Estates,31 Orchard Street - 14 Apartments,District,Renovation,,,Domestic,Residential,Unknown,,,,,,,,,,,Yes,,,,,Under Construction,Under Construction,"Bulwer Gardens, Barnet",London,London,England,EN5 5JF,526150,196275,Barnet,,,,,,,,,,,,,,,,,,01/08/2023,,
13871,,17/05/2023,Hackhurst Partnership,"Hackhurst Lane, Lower Dicker - Ground Source Heat Pump",Communal,New,498,1,Mixed,"Residential, Retail",Air Source Heat Pumps,,,,,,Electric,,25.00,,,Yes,,No,6500.00,,Planning Permission Granted,Awaiting Construction,"Ensign House, 17 Admirals Way, Isle Of Dogs, Poplar",London,London,England,E14 9XQ,537466,179910,Tower Hamlets,PA/21/00952/A1,,,,,13/05/2021,,,,,,,16/02/2022,,,,,,,
13872,,17/04/2024,University of Surrey / SSE Energy Solutions,University of Surrey - Energy Centre,Communal,New,21,1,Mixed,"Residential, Community Hub",Air Source Heat Pumps,,,,,,Electric,,,,,Yes,,No,,,Planning Permission Granted,Awaiting Construction,"1 Lincoln Street, Coventry",West Midlands,West Midlands,England,CV1 4JN,433498,279655,Coventry,PL/2023/0000763/FULM,,,,,26/04/2023,,,,,,,21/11/2023,,,,21/11/2026,,,
13873,,11/05/2023,London Borough of Hillingdon,Yiewsley Library - 95 Apartments,Communal,New,18,1,Domestic,Residential,Air Source Heat Pumps,,,,,,Electric,,,,,Yes,,No,,,Planning Permission Granted,Awaiting Construction,"2a Trinity Road, Wimbledon",London,London,England,SW19 8QX,525458,170585,Merton,21/P3215,,,,,21/09/2021,,,,,,,05/04/2023,,,,,,,
13874,,11/05/2023,Bar Stone Developments Limited,"Ewing House, King Edward Road - 35 Flats",Communal,New,95,2,Domestic,Care Village,Air Source Heat Pumps,,,,,,Electric,,,,,Yes,,No,,,Planning Application Submitted,Application Submitted,"Former Site Of Molson Coors Brewing Co, Manor Park, Lower Turk Street, Alton",Hampshire,South East,England,GU34 2PS,471953,139206,East Hampshire,25050/065,,,,,14/04/2023,,,,,,,,,,,,,,
13875,,12/05/2023,B M Technical Limited,32-42 Duke Street - 18 Flats,Campus,New,1,2,Non Domestic,Agricultural,Biomass (dedicated), ,, ,0.50, ,Woodchip, , , , ,Yes, ,No, , ,Planning Permission Granted,Awaiting Construction,Adjacent To Briarbank Mintlaw,Aberdeenshire,Scotland,Scotland,AB42 5JR,398521,848899,Aberdeenshire,APP/2023/0698, , , , ,27/04/2023,,,,,,,23/06/2023,,,,23/06/2026,,,
13876,,28/06/2023,Davidson Kempner Capital Management,Buchanan House - Mixed Development,Communal,New,42,1,Domestic,Residential,Air Source Heat Pumps,,,,,,Electric,,,,,Yes,,No,,,Planning Application Withdrawn,Application Withdrawn,"140 Queens Road & Garages, R/O 35 Portland Road, Leicester",Leicestershire,East Midlands,England,LE2 3FX,459964,302395,Leicester,20230456,,,,,19/04/2023,22/06/2023,,,,,,,,,,,,,
13877,,17/05/2023,Peel Natural Resources and Energy (NRE),Wirral Waters - Energy Centre &  District Heating Netwo,Communal,New,108,1,Mixed,"Student Accommodation, Office, Café, Library",Air Source Heat Pumps,,,,,,Electric,,,,,Yes,,No,,,Planning Application Submitted,Application Submitted,"Library For Iranian Studies, The Woodlands Hall, Crown Street, Acton",London,London,England,W3 8SA,519892,180138,Ealing,215858FUL,,,,,27/09/2021,,,,,,,,,,,,,,
13878,,17/05/2023,National Pride,"Barony Road, Auchinleck - Eco Wellness Centre",District,New,58,2,Mixed,"Care Village, Community Hub",Gas Fired CHP,,,,,,Gas,,,,,Yes,,Yes,,,Under Construction,Under Construction,"Former North Hill Sawmill Yard, Baddesley Road, Flexford, North Baddesley, Southampton",Hampshire,South East,England,SO52 9BH,442147,122144,Test Valley,20/00488/RESS,,,,,02/03/2020,,,,,,,30/01/2019,,,,,01/05/2022,,
